{
  "apiVersion": "criteria.brokenbots.dev/v1",
  "kind": "WorkflowInterface",
  "workflow": "ts_smoke_v1",
  "description": "TypeScript-SDK isolation smoke (clone of labs_smoke_v1 asserting ns typescript-sdk): single shell adapter, data + repo PVC mounts, scratch tmp, no secrets. Declares the binding's config slots (baseBranch, ciGateCmd) as tolerated overrides; the tree itself uses neither.",
  "adapters": [
    "shell"
  ],
  "mounts": [
    {
      "name": "data",
      "mountPath": "/data",
      "kind": "pvc"
    },
    {
      "name": "repo",
      "mountPath": "/repo",
      "kind": "pvc"
    },
    {
      "name": "scratch",
      "mountPath": "/tmp/scratch",
      "kind": "tmp"
    }
  ],
  "secretEnv": [],
  "env": [],
  "configSlots": [
    {
      "slot": "baseBranch",
      "variable": "base_branch",
      "target": "adapter.shell.probe",
      "description": "base branch override tolerated from the ts binding config; unused by this tree"
    },
    {
      "slot": "ciGateCmd",
      "variable": "ci_gate_cmd",
      "target": "adapter.shell.probe",
      "description": "ci gate command tolerated from the ts binding config; unused by this tree"
    }
  ]
}
