{
  "apiVersion": "criteria.brokenbots.dev/v1",
  "kind": "WorkflowInterface",
  "workflow": "harness_contracts_v1",
  "description": "Harness contracts canary (copilot+shell). Mounts and secret lanes mirror the shipped harness-contracts-url binding; probe_root rides the data lane.",
  "adapters": ["copilot","shell"],
  "mounts": [{"name":"data","mountPath":"/data","kind":"pvc"},{"name":"repo","mountPath":"/repo","kind":"pvc"},{"name":"scratch","mountPath":"/tmp/scratch","kind":"tmp"}],
  "secretEnv": ["WORKFLOW_GITHUB_TOKEN"],
  "env": [],
  "configSlots": []
}
