{
  "apiVersion": "criteria.brokenbots.dev/v1",
  "kind": "WorkflowInterface",
  "workflow": "harness_composition_v1",
  "description": "Harness composition canary (shell-only parallel composition). Mounts mirror the shipped harness-composition-url binding; declares no secret lanes.",
  "adapters": ["shell"],
  "mounts": [{"name":"data","mountPath":"/data","kind":"pvc"},{"name":"repo","mountPath":"/repo","kind":"pvc"},{"name":"scratch","mountPath":"/tmp/scratch","kind":"tmp"}],
  "secretEnv": [],
  "env": [],
  "configSlots": []
}
