{
  "apiVersion": "criteria.brokenbots.dev/v1",
  "kind": "WorkflowInterface",
  "workflow": "kanboard_triage_v1",
  "description": "Triage lane: investigator/supervisor tree plus locked qa_triage_v1/review_output subworkflows (copilot+shell). Mounts and secret lanes mirror the shipped kanboard-triage-url binding (no reviewer token: the tree declares no reviewer secret var). build_cmd/test_cmd drive the investigator repro checks.",
  "adapters": ["copilot","shell"],
  "mounts": [{"name":"data","mountPath":"/data","kind":"pvc"},{"name":"repo","mountPath":"/repo","kind":"pvc"},{"name":"scratch","mountPath":"/tmp/scratch","kind":"tmp"}],
  "secretEnv": ["KANBOARD_APP_TOKEN","KANBOARD_URL","WORKFLOW_GITHUB_TOKEN"],
  "env": [],
  "configSlots": [{"slot":"buildCmd","variable":"build_cmd","target":"qa_triage repro checks (build)","description":"Command the repro build leg runs against the fetched repo."},{"slot":"testCmd","variable":"test_cmd","target":"qa_triage repro checks (test)","description":"Command the repro test leg runs against the fetched repo."}]
}
